[
  {
    "id": 1,
    "reference_code": "co-ahrb-f001",
    "title": "Fondo Histórico del Archivo de Rionegro",
    "description_level": "fonds",
    "parent_reference_code": null,
    "repository_code": "co-ahrb",
    "date_expression": "1750 .. 1900",
    "date_start": "1750-01-01",
    "scope_content": "Documentos del período colonial relativos a la administración local.\nIncluye escrituras notariales, testamentos y pleitos civiles.",
    "extent": "3 metros lineales de documentos en papel",
    "arrangement": "Organizado en series temáticas",
    "access_conditions": "",
    "reproduction_conditions": "",
    "language": "spa",
    "location_of_originals": "",
    "location_of_copies": "",
    "related_materials": "",
    "finding_aids": "",
    "notes": "",
    "iiif_manifest_url": "",
    "ocr_text": ""
  },
  {
    "id": 2,
    "reference_code": "co-ahrb-f001-001",
    "title": "Testamento de Juan López de Herrera",
    "description_level": "file",
    "parent_reference_code": "co-ahrb-f001",
    "repository_code": "co-ahrb",
    "date_expression": "12 de junio de 1756",
    "date_start": "1756-06-12",
    "scope_content": "Testamento otorgado ante el escribano público Francisco de Salazar.",
    "extent": "4 folios",
    "arrangement": "",
    "access_conditions": "Acceso libre",
    "reproduction_conditions": "Reproducción permitida con fines académicos",
    "language": "spa",
    "location_of_originals": "",
    "location_of_copies": "",
    "related_materials": "",
    "finding_aids": "",
    "notes": "",
    "iiif_manifest_url": "https://example.org/iiif/co-ahrb-f001-001/manifest.json",
    "ocr_text": ""
  },
  {
    "id": 3,
    "reference_code": "co-ahrb-f001-002",
    "title": "Escritura de compraventa",
    "description_level": "file",
    "parent_reference_code": "co-ahrb-f001",
    "repository_code": "co-ahrb",
    "date_expression": "1823",
    "date_start": "1823-01-01",
    "scope_content": "Escritura de compraventa de un solar en la ciudad de Bogotá.",
    "extent": "2 folios",
    "arrangement": "",
    "access_conditions": "",
    "reproduction_conditions": "",
    "language": "spa",
    "location_of_originals": "",
    "location_of_copies": "",
    "related_materials": "",
    "finding_aids": "",
    "notes": "",
    "iiif_manifest_url": "",
    "ocr_text": ""
  }
]